{
  "artifact_version": "editorial-eye-benchmark-report/v1",
  "suite_id": "editorial-eye-v1",
  "suite_version": "1.0.0",
  "baseline_commit": "e431da43c7fe7f4f50a688c3e8fcb48b50511453",
  "candidate_commit": "e431da43c7fe7f4f50a688c3e8fcb48b50511453",
  "baseline_report_sha256": null,
  "fixture_manifest_sha256": "454df2fd5fdc94a740990b1b5c5342b8f407dd379d973cc2854f40214a25824c",
  "label_version": "labels-v2",
  "generator": {
    "id": "editorial-eye-lavfi-fixtures",
    "version": "1.0.0",
    "fixture_set_id": "editorial-eye-v1-7x5"
  },
  "provenance": {
    "environment": {
      "execution": "deterministic_generated_contract",
      "platform": "portable",
      "benchmark_scope": "metric_adapter_oracle_not_pipeline_or_model_quality"
    },
    "models": [],
    "degraded": []
  },
  "metrics": {
    "automatic_binary": {
      "grounded_visual_success": {
        "status": "measured",
        "value": 1,
        "numerator": 21,
        "denominator": 21
      },
      "observation_field_coverage": {
        "status": "measured",
        "value": 1,
        "numerator": 119,
        "denominator": 119
      },
      "observation_agreement_accuracy": {
        "status": "measured",
        "value": 1,
        "numerator": 119,
        "denominator": 119
      },
      "confidence_calibration": {
        "status": "measured",
        "ece": 0,
        "sample_count": 119,
        "minimum_sample_count": 5,
        "bins": [
          {
            "lower": 0,
            "upper": 0.2,
            "count": 0,
            "mean_confidence": null,
            "accuracy": null
          },
          {
            "lower": 0.2,
            "upper": 0.4,
            "count": 0,
            "mean_confidence": null,
            "accuracy": null
          },
          {
            "lower": 0.4,
            "upper": 0.6,
            "count": 0,
            "mean_confidence": null,
            "accuracy": null
          },
          {
            "lower": 0.6,
            "upper": 0.8,
            "count": 0,
            "mean_confidence": null,
            "accuracy": null
          },
          {
            "lower": 0.8,
            "upper": 1,
            "count": 119,
            "mean_confidence": 1,
            "accuracy": 1
          }
        ]
      },
      "pair_relation": {
        "status": "unmeasured",
        "macro_f1": null,
        "sample_count": 0,
        "labels": [],
        "confusion_matrix": {}
      },
      "false_hard_fail_rate": {
        "status": "unmeasured",
        "value": null,
        "numerator": 0,
        "denominator": 0
      }
    },
    "human": {
      "human_accuracy": {
        "status": "unmeasured",
        "value": null,
        "numerator": 0,
        "denominator": 0
      },
      "human_f1": {
        "status": "unmeasured",
        "macro_f1": null,
        "sample_count": 0,
        "labels": [],
        "confusion_matrix": {}
      }
    },
    "legacy_artifact_agreement": {
      "status": "unmeasured",
      "score": null
    }
  },
  "breakdowns": {
    "by_genre": {
      "interview_dialogue": {
        "applicable": 4,
        "unsupported": 1,
        "unmeasured": 0,
        "success": 4,
        "failure": 0
      },
      "quiet_documentary": {
        "applicable": 4,
        "unsupported": 1,
        "unmeasured": 0,
        "success": 4,
        "failure": 0
      },
      "product_detail": {
        "applicable": 4,
        "unsupported": 1,
        "unmeasured": 0,
        "success": 4,
        "failure": 0
      },
      "action_event": {
        "applicable": 4,
        "unsupported": 1,
        "unmeasured": 0,
        "success": 4,
        "failure": 0
      },
      "vertical_social_montage": {
        "applicable": 4,
        "unsupported": 1,
        "unmeasured": 0,
        "success": 4,
        "failure": 0
      },
      "chronological_longform": {
        "applicable": 4,
        "unsupported": 1,
        "unmeasured": 0,
        "success": 4,
        "failure": 0
      },
      "intentional_jump_smash_match": {
        "applicable": 4,
        "unsupported": 1,
        "unmeasured": 0,
        "success": 4,
        "failure": 0
      }
    },
    "by_media_kind": {
      "video": {
        "applicable": 7,
        "unsupported": 0,
        "unmeasured": 0,
        "success": 7,
        "failure": 0
      },
      "audio": {
        "applicable": 7,
        "unsupported": 0,
        "unmeasured": 0,
        "success": 7,
        "failure": 0
      },
      "image": {
        "applicable": 7,
        "unsupported": 0,
        "unmeasured": 0,
        "success": 7,
        "failure": 0
      },
      "sequence": {
        "applicable": 0,
        "unsupported": 7,
        "unmeasured": 0,
        "success": 0,
        "failure": 0
      },
      "mixed": {
        "applicable": 7,
        "unsupported": 0,
        "unmeasured": 0,
        "success": 7,
        "failure": 0
      }
    },
    "metrics_by_genre": {
      "interview_dialogue": {
        "grounded_visual_success": {
          "status": "measured",
          "value": 1,
          "numerator": 3,
          "denominator": 3
        },
        "observation_field_coverage": {
          "status": "measured",
          "value": 1,
          "numerator": 17,
          "denominator": 17
        },
        "observation_agreement_accuracy": {
          "status": "measured",
          "value": 1,
          "numerator": 17,
          "denominator": 17
        },
        "confidence_calibration": {
          "status": "measured",
          "ece": 0,
          "sample_count": 17,
          "minimum_sample_count": 5,
          "bins": [
            {
              "lower": 0,
              "upper": 0.2,
              "count": 0,
              "mean_confidence": null,
              "accuracy": null
            },
            {
              "lower": 0.2,
              "upper": 0.4,
              "count": 0,
              "mean_confidence": null,
              "accuracy": null
            },
            {
              "lower": 0.4,
              "upper": 0.6,
              "count": 0,
              "mean_confidence": null,
              "accuracy": null
            },
            {
              "lower": 0.6,
              "upper": 0.8,
              "count": 0,
              "mean_confidence": null,
              "accuracy": null
            },
            {
              "lower": 0.8,
              "upper": 1,
              "count": 17,
              "mean_confidence": 1,
              "accuracy": 1
            }
          ]
        },
        "pair_relation": {
          "status": "unmeasured",
          "macro_f1": null,
          "sample_count": 0,
          "labels": [],
          "confusion_matrix": {}
        },
        "false_hard_fail_rate": {
          "status": "unmeasured",
          "value": null,
          "numerator": 0,
          "denominator": 0
        }
      },
      "quiet_documentary": {
        "grounded_visual_success": {
          "status": "measured",
          "value": 1,
          "numerator": 3,
          "denominator": 3
        },
        "observation_field_coverage": {
          "status": "measured",
          "value": 1,
          "numerator": 17,
          "denominator": 17
        },
        "observation_agreement_accuracy": {
          "status": "measured",
          "value": 1,
          "numerator": 17,
          "denominator": 17
        },
        "confidence_calibration": {
          "status": "measured",
          "ece": 0,
          "sample_count": 17,
          "minimum_sample_count": 5,
          "bins": [
            {
              "lower": 0,
              "upper": 0.2,
              "count": 0,
              "mean_confidence": null,
              "accuracy": null
            },
            {
              "lower": 0.2,
              "upper": 0.4,
              "count": 0,
              "mean_confidence": null,
              "accuracy": null
            },
            {
              "lower": 0.4,
              "upper": 0.6,
              "count": 0,
              "mean_confidence": null,
              "accuracy": null
            },
            {
              "lower": 0.6,
              "upper": 0.8,
              "count": 0,
              "mean_confidence": null,
              "accuracy": null
            },
            {
              "lower": 0.8,
              "upper": 1,
              "count": 17,
              "mean_confidence": 1,
              "accuracy": 1
            }
          ]
        },
        "pair_relation": {
          "status": "unmeasured",
          "macro_f1": null,
          "sample_count": 0,
          "labels": [],
          "confusion_matrix": {}
        },
        "false_hard_fail_rate": {
          "status": "unmeasured",
          "value": null,
          "numerator": 0,
          "denominator": 0
        }
      },
      "product_detail": {
        "grounded_visual_success": {
          "status": "measured",
          "value": 1,
          "numerator": 3,
          "denominator": 3
        },
        "observation_field_coverage": {
          "status": "measured",
          "value": 1,
          "numerator": 17,
          "denominator": 17
        },
        "observation_agreement_accuracy": {
          "status": "measured",
          "value": 1,
          "numerator": 17,
          "denominator": 17
        },
        "confidence_calibration": {
          "status": "measured",
          "ece": 0,
          "sample_count": 17,
          "minimum_sample_count": 5,
          "bins": [
            {
              "lower": 0,
              "upper": 0.2,
              "count": 0,
              "mean_confidence": null,
              "accuracy": null
            },
            {
              "lower": 0.2,
              "upper": 0.4,
              "count": 0,
              "mean_confidence": null,
              "accuracy": null
            },
            {
              "lower": 0.4,